{
  "$schema": "https://aos-data.org/schema/regiment-of-renown.schema.json",
  "id": "exile-scavengers",
  "name": "Exile Scavengers",
  "points": 410,
  "allowedFactions": [
    "Beasts of Chaos [LEGENDS]",
    "Bonesplitterz [LEGENDS]",
    "Cities of Sigmar",
    "Daughters of Khaine",
    "Fyreslayers",
    "Gloomspite Gitz",
    "Ironjawz",
    "Kruleboyz",
    "Lumineth Realm-lords",
    "Ogor Mawtribes",
    "Ossiarch Bonereapers",
    "Seraphon",
    "Slaves to Darkness",
    "Slaves to Darkness - Legion of the First Prince",
    "Sons of Behemat",
    "Soulblight Gravelords"
  ],
  "units": [
    {
      "name": "Skywardens",
      "count": 1,
      "required": true
    },
    {
      "name": "Grundstok Gunhauler",
      "count": 1,
      "required": true
    },
    {
      "name": "Endrinmaster with Dirigible Suit",
      "count": 1,
      "required": true
    }
  ],
  "abilities": [
    {
      "name": "An Eye for Loot",
      "type": "passive",
      "effect": "Set up the units in this Regiment of Renown in reserve studying the battlefield. They have now been deployed.",
      "declare": "This ability must be used to deploy this Regiment of Renown.",
      "keywords": [
        "**^^DEPLOY^^**"
      ],
      "color": "Black",
      "abilityCategory": "Special"
    },
    {
      "name": "Swoop In",
      "type": "passive",
      "effect": "Set up the **Grundstok Gunhauler** on the battlefield more than 6\" from all enemy units that have an artefact of power and more than 9\" from all other enemy units. Then, set up all other units in this Regiment of Renown wholly within 3\" of the **Grundstok Gunhauler** and more than 6\" from all enemy units.",
      "phase": "movement",
      "declare": "Pick the **Grundstok Gunhauler** in this Regiment of Renown to use this ability if it is studying the battlefield.",
      "color": "Gray",
      "abilityCategory": "Movement"
    },
    {
      "name": "'What's Yours is Mine'",
      "type": "once-per-turn",
      "effect": "Roll a dice. Add 1 to the roll for each unit in this Regiment of Renown that is in combat with the target. On a 6+, the target no longer has that artefact of power.",
      "phase": "combat",
      "declare": "Pick an enemy unit in combat with a unit in this Regiment of Renown to be the target. Then, pick an artefact of power the target has.",
      "color": "Red",
      "abilityCategory": "Special"
    }
  ],
  "_meta": {
    "lastUpdated": "2026-01-08",
    "source": "BSData import"
  }
}
