{
  "$schema": "https://aos-data.org/schema/regiment-of-renown.schema.json",
  "id": "elthwins-thorns",
  "name": "Elthwin's Thorns",
  "points": 220,
  "allowedFactions": [
    "Cities of Sigmar",
    "Daughters of Khaine",
    "Fyreslayers",
    "Idoneth Deepkin",
    "Kharadron Overlords",
    "Lumineth Realm-lords",
    "Seraphon",
    "Stormcast Eternals"
  ],
  "units": [
    {
      "name": "Gossamid Archers",
      "count": 1,
      "required": true
    },
    {
      "name": "Arch-Revenant",
      "count": 1,
      "required": true
    }
  ],
  "abilities": [
    {
      "name": "Gossamid Champion",
      "type": "passive",
      "effect": "Until the start of your next turn, subtract X from charge rolls for the target, where X is the number of damage points allocated to the target this phase by shooting attacks made by the **Gossamid Archers** unit in the Regiment of Renown, to a maximum of 6.",
      "phase": "shooting",
      "declare": "Pick the **Arch-Revenant** in this Regiment of Renown to use this ability, the pick a visible enemy unit within 12\" of them to be the target.",
      "color": "Blue",
      "abilityCategory": "Shooting"
    },
    {
      "name": "Flight of the Zephyrspites",
      "type": "once-per-turn",
      "effect": "If both units in this Regiment of Renown are within each other’s combat range and neither unit is in combat, roll a dice. On a 3+, remove both units from the battlefield, then set them up again within each other’s combat range, wholly within 3\" of a terrain feature and more than 9\" from all enemy units.",
      "phase": "shooting",
      "color": "Blue",
      "abilityCategory": "Shooting"
    }
  ],
  "_meta": {
    "lastUpdated": "2026-01-07",
    "source": "BSData import"
  }
}
